{
  "$schema": "https://json-schema.org/draft/2020-12/schema",
  "properties": {
    "apiVersion": {
      "enum": [
        "agentplane.socioprophet.org/v0.1"
      ],
      "type": "string"
    },
    "kind": {
      "enum": [
        "Bundle"
      ],
      "type": "string"
    },
    "metadata": {
      "properties": {
        "createdAt": {
          "type": "string"
        },
        "licensePolicy": {
          "description": "Our internal compliance gate: declare that bundle contents are shippable under our rules.",
          "properties": {
            "allowAGPL": {
              "enum": [
                false
              ],
              "type": "boolean"
            },
            "notes": {
              "type": "string"
            }
          },
          "type": "object"
        },
        "name": {
          "pattern": "^[a-z0-9][a-z0-9-]{1,62}$",
          "type": "string"
        },
        "source": {
          "properties": {
            "git": {
              "properties": {
                "dirty": {
                  "type": "boolean"
                },
                "rev": {
                  "type": "string"
                }
              },
              "type": "object"
            }
          },
          "type": "object"
        },
        "version": {
          "type": "string"
        }
      },
      "required": [
        "name",
        "version",
        "createdAt"
      ],
      "type": "object"
    },
    "spec": {
      "properties": {
        "artifacts": {
          "properties": {
            "outDir": {
              "description": "Where proof artifacts are written (run/policy/promotion/replay/receipt)",
              "type": "string"
            }
          },
          "required": [
            "outDir"
          ],
          "type": "object"
        },
        "executor": {
          "properties": {
            "ref": {
              "type": "string"
            }
          },
          "type": "object"
        },
        "outputs": {
          "description": "Optional output references emitted by image-production, proof, or release lanes.",
          "properties": {
            "bootReleaseSetRef": {
              "type": "string"
            },
            "evidenceBundleRef": {
              "type": "string"
            },
            "katelloContentRef": {
              "type": "string"
            },
            "ostreeRef": {
              "type": "string"
            },
            "releaseSetRef": {
              "type": "string"
            },
            "smokeReceiptRef": {
              "type": "string"
            }
          },
          "type": "object"
        },
        "policy": {
          "description": "TrustFirst Policy Pack pointer(s) and hashes; contents live elsewhere.",
          "properties": {
            "failOnTimeout": {
              "type": "boolean"
            },
            "humanGateRequired": {
              "type": "boolean"
            },
            "lane": {
              "enum": [
                "staging",
                "prod"
              ],
              "type": "string"
            },
            "maxRunSeconds": {
              "maximum": 3600,
              "minimum": 5,
              "type": "integer"
            },
            "policyPackHash": {
              "type": "string"
            },
            "policyPackRef": {
              "type": "string"
            }
          },
          "type": "object"
        },
        "secrets": {
          "description": "Secrets are refs/paths only — never inline values.",
          "properties": {
            "required": {
              "items": {
                "type": "string"
              },
              "type": "array"
            },
            "secretRefRoot": {
              "type": "string"
            }
          },
          "type": "object"
        },
        "smoke": {
          "properties": {
            "script": {
              "type": "string"
            }
          },
          "required": [
            "script"
          ],
          "type": "object"
        },
        "sociosAutomation": {
          "description": "Optional binding to SociOS-Linux/socios automation lanes such as Foreman/Katello, Smart Proxy, Tekton, and Argo CD.",
          "properties": {
            "argocdApplicationRef": {
              "type": "string"
            },
            "katelloContentModelRef": {
              "type": "string"
            },
            "katelloContentView": {
              "type": "string"
            },
            "katelloLifecycleEnvironment": {
              "enum": [
                "dev",
                "qa",
                "prod",
                "site",
                "custom"
              ],
              "type": "string"
            },
            "katelloProduct": {
              "type": "string"
            },
            "katelloRepository": {
              "type": "string"
            },
            "smartProxyRef": {
              "type": "string"
            },
            "substrateDocRef": {
              "type": "string"
            },
            "tektonPipelineRef": {
              "type": "string"
            },
            "tektonTaskRefs": {
              "items": {
                "type": "string"
              },
              "type": "array"
            }
          },
          "type": "object"
        },
        "sourceos": {
          "description": "Optional SourceOS artifact-truth binding for image-production, installer, recovery, ReleaseSet, and BootReleaseSet lanes.",
          "properties": {
            "artifactTruthRef": {
              "type": "string"
            },
            "bootReleaseSetRef": {
              "type": "string"
            },
            "butaneRefs": {
              "items": {
                "type": "string"
              },
              "type": "array"
            },
            "channelRef": {
              "type": "string"
            },
            "cosaRef": {
              "type": "string"
            },
            "flavorRef": {
              "type": "string"
            },
            "installerProfileRef": {
              "type": "string"
            },
            "manifestRef": {
              "type": "string"
            },
            "releaseSetRef": {
              "type": "string"
            },
            "sourceosSpecRef": {
              "type": "string"
            }
          },
          "type": "object"
        },
        "chronosCarrier": {
          "description": "Optional CHRONOS neuro-symbolic carrier passthrough (additive bridge extension; agentplane does not own this taxonomy -- see docs/sociosphere-bridge.md).",
          "properties": {
            "sourceEvidenceRef": {
              "type": "string"
            },
            "methodFamily": {
              "type": "string"
            },
            "claimStatus": {
              "type": "string"
            },
            "validationStatus": {
              "type": "string"
            },
            "nonAuthorityDeclaration": {
              "type": "boolean"
            },
            "owningPlane": {
              "type": "string"
            },
            "replayRef": {
              "type": "string"
            }
          },
          "type": "object"
        },
        "agentMachine": {
          "description": "Optional SourceOS Agent Machine binding for local Mac/Windows/Linux Podman workspaces and cluster-local TopoLVM placement.",
          "properties": {
            "profileRef": { "type": "string" },
            "localDataPlaneRef": { "type": "string" },
            "mountPolicyRef": { "type": "string" },
            "secureHostInterfaceRef": { "type": "string" },
            "topolvmPlacementProfileRef": { "type": "string" },
            "workspaceId": { "type": "string" },
            "toolSurfaceRefs": {
              "type": "array",
              "items": { "type": "string" }
            }
          },
          "type": "object"
        },
        "vm": {
          "properties": {
            "backendIntent": {
              "enum": [
                "qemu",
                "microvm",
                "lima-process",
                "fleet",
                "agent-machine"
              ],
              "type": "string"
            },
            "modulePath": {
              "description": "Path to NixOS module entry (e.g., vm.nix). Agent Machine bundles may use an adapter module path rather than a NixOS VM module.",
              "type": "string"
            },
            "mounts": {
              "items": {
                "properties": {
                  "ro": {
                    "type": "boolean"
                  },
                  "source": {
                    "type": "string"
                  },
                  "target": {
                    "type": "string"
                  },
                  "type": {
                    "enum": [
                      "virtiofs",
                      "9p",
                      "podman-bind",
                      "wsl-bind",
                      "topolvm-local-pv",
                      "none"
                    ],
                    "type": "string"
                  }
                },
                "required": [
                  "type",
                  "source",
                  "target",
                  "ro"
                ],
                "type": "object"
              },
              "type": "array"
            },
            "network": {
              "properties": {
                "egressAllowlist": {
                  "items": {
                    "type": "string"
                  },
                  "type": "array"
                },
                "mode": {
                  "enum": [
                    "none",
                    "nat",
                    "bridge",
                    "slirp"
                  ],
                  "type": "string"
                }
              },
              "type": "object"
            },
            "resources": {
              "properties": {
                "diskGiB": {
                  "type": "integer"
                },
                "memMiB": {
                  "type": "integer"
                },
                "vcpu": {
                  "type": "integer"
                }
              },
              "type": "object"
            }
          },
          "required": [
            "modulePath",
            "backendIntent"
          ],
          "type": "object"
        }
      },
      "required": [
        "vm",
        "secrets",
        "policy",
        "artifacts",
        "smoke"
      ],
      "type": "object"
    }
  },
  "required": [
    "apiVersion",
    "kind",
    "metadata",
    "spec"
  ],
  "title": "Agentplane Bundle Schema v0.1",
  "type": "object"
}
