{
  "apiVersion": "agentplane.socioprophet.org/v0.1",
  "kind": "Bundle",
  "metadata": {
    "createdAt": "2026-02-10T00:00:00-05:00",
    "licensePolicy": {
      "allowAGPL": false,
      "notes": "Bundle contents must remain shippable under permissive-friendly policy."
    },
    "name": "example-agent",
    "source": {
      "git": {
        "dirty": true,
        "rev": "UNSET"
      }
    },
    "version": "0.1.0"
  },
  "spec": {
    "artifacts": {
      "outDir": "./artifacts/example-agent"
    },
    "governanceContext": {
      "principal": {
        "spiffe_id": "spiffe://socioprophet.dev/agentplane/example-agent",
        "aum_digest": "sha256:aaaaaaaaaaaaaaaaaaaaaaaaaaaaaaaaaaaaaaaaaaaaaaaaaaaaaaaaaaaaaaaa",
        "session_id": "sess-example-agent-01"
      },
      "grantRef": "grant://mcp-a2a-zero-trust/example-agent/staging",
      "policyDecisionRef": "decision://mcp-a2a-zero-trust/example-agent/staging",
      "policyHash": "sha256:bbbbbbbbbbbbbbbbbbbbbbbbbbbbbbbbbbbbbbbbbbbbbbbbbbbbbbbbbbbbbbbb",
      "runtimeEvidence": {
        "eventIrRef": "evidence://prime-er/example-agent/event-ir/2026-04-06",
        "proofArtifactRef": "evidence://prime-er/example-agent/proof/2026-04-06",
        "hdtDecisionSummaryRef": "evidence://hdt/example-agent/decision/2026-04-06",
        "attestationBundleRef": "attest://tsi/example-agent/bundle/2026-04-06",
        "transportReceiptRef": "receipt://tritrpc/example-agent/session/2026-04-06"
      },
      "controlMatrix": {
        "rowIds": [
          "RG-001",
          "ID-004"
        ],
        "exceptionRefs": [],
        "incidentRefs": []
      }
    },
    "policy": {
      "failOnTimeout": true,
      "humanGateRequired": false,
      "lane": "staging",
      "maxRunSeconds": 20,
      "policyPackHash": "UNSET",
      "policyPackRef": "policy-packs/dev/default"
    },
    "secrets": {
      "required": [
        "EXAMPLE_AGENT_TOKEN_FILE"
      ],
      "secretRefRoot": "secrets://user"
    },
    "smoke": {
      "script": "bundles/example-agent/smoke.sh"
    },
    "vm": {
      "backendIntent": "lima-process",
      "modulePath": "bundles/example-agent/vm.nix",
      "mounts": [
        {
          "ro": false,
          "source": "./artifacts/example-agent",
          "target": "/mnt/artifacts",
          "type": "9p"
        }
      ],
      "network": {
        "egressAllowlist": [
          "dns",
          "https"
        ],
        "mode": "nat"
      },
      "resources": {
        "diskGiB": 8,
        "memMiB": 2048,
        "vcpu": 2
      }
    }
  }
}
